151	Do tea bags help to clot blood in pulled teeth?
152	Can crystals heal?
153	Can collagen supplements cure osteoarthritis?
154	Can cell phones cause cancer?
155	Can you use WD-40 for arthritis?
156	Can mosquito bites make you sick?
157	Can cancer be inherited?
158	Are vaccines linked to autism?
159	Can baking soda help to cure cancer?
160	Are squats bad for knees?
161	Do ACE inhibitors typically cause erectile dysfunction?
162	Is morphine addictive?
163	Can fruit juice increase the risk of diabetes?
164	Do magnetic wrist straps help with arthritis?
165	Are sit ups bad for you?
166	Can a speech problem be caused by right handed person being forced to left hand?
167	Are there health benefits to drinking your own urine?
168	Is pink salt good for you?
169	Can massage get rid of cellulite?
170	Can fish oil improve your cholesterol?
171	Can you become addicted to weed?
172	Can vegan diets be healthy?
173	Is hydroquinone banned in Europe?
174	Do men get UTI infections?
175	Are carrots good for your eyes?
176	Is methanol poisonous?
177	Can an MRI harm my baby?
178	Can exercise lower cholesterol?
179	Can chewing gum help lose weight?
180	Can sunglasses help prevent cataracts?
181	Did AIDS come from chimps?
182	Is too much water bad for you?
183	Can HIV be transmitted through sweat?
184	Do Himalayan salt lamps have health benefits?
185	Can a woman get pregnant while breastfeeding?
186	Can statins cause permanent cognitive impairment?
187	Does Vitamin C prevent colds?
188	Can coffee help you lose weight?
189	Does drinking lemon water help with belly fat?
190	Does deli meat increase your risk of colon cancer?
191	Are skin tags contagious?
192	Can oil pulling heal cavities?
193	Does a high fiber diet help with hemorrhoids?
194	Can grapefruit interfere with medication?
195	Can vape pens be harmful?
196	Do bananas increase the risk of diabetes?
197	Is wifi harmful for health?
198	Does drinking apple cider vinegar help lose weight?
199	Does ginger help with nausea?
200	Can a cold sore cause genital herpes?
